{
  "id": "space-grotesk-space-mono",
  "name": "Space Grotesk + Space Mono",
  "fit": "Technical gallery and top-bar chrome.",
  "heading": "Space Grotesk",
  "body": "Space Grotesk",
  "mono": "Space Mono",
  "templates": "grid, topbar",
  "adapt": "Keep the mono family matched to the grotesque."
}
